{
  "$schema": "https://json-schema.org/draft/2020-12/schema",
  "$id": "https://agentport.dev/schemas/agentport-conformance-report.schema.json",
  "title": "AgentPort Conformance Report",
  "type": "object",
  "additionalProperties": false,
  "required": ["protocol", "version", "implementation", "profiles", "generatedAt"],
  "properties": {
    "$schema": { "type": "string" },
    "protocol": { "const": "agentport" },
    "version": { "const": "0.1" },
    "implementation": {
      "type": "object",
      "additionalProperties": false,
      "required": ["name", "version"],
      "properties": {
        "name": { "type": "string", "minLength": 1 },
        "version": { "type": "string", "minLength": 1 },
        "buildId": { "type": "string", "minLength": 1 },
        "operator": { "type": "string", "minLength": 1 }
      }
    },
    "profiles": {
      "type": "array",
      "minItems": 1,
      "items": {
        "type": "object",
        "additionalProperties": false,
        "required": ["name", "status", "testsPassed", "testsFailed", "testsSkipped"],
        "properties": {
          "name": {
            "enum": [
              "core-runtime",
              "capability-honesty",
              "authority-evidence-checkpoint",
              "token-confirmation",
              "action-receipt",
              "compact-payload-retention",
              "gateway-protocol",
              "plugin-wallet"
            ]
          },
          "status": { "enum": ["passed", "failed", "skipped", "not_applicable"] },
          "testsPassed": { "type": "integer", "minimum": 0 },
          "testsFailed": { "type": "integer", "minimum": 0 },
          "testsSkipped": { "type": "integer", "minimum": 0 },
          "deviations": {
            "type": "array",
            "items": { "type": "string" },
            "default": []
          },
          "unsupportedOptionalFeatures": {
            "type": "array",
            "items": { "type": "string" },
            "default": []
          },
          "evidence": {
            "type": "array",
            "items": { "type": "string", "minLength": 1 },
            "default": []
          }
        }
      }
    },
    "generatedAt": { "type": "string", "format": "date-time" }
  }
}
